[
  {
    "id": "rfc-6585-429",
    "title": "RFC 6585 section 4: 429 Too Many Requests",
    "organization": "IETF",
    "url": "https://www.rfc-editor.org/rfc/rfc6585.html#section-4",
    "sourceType": "standard",
    "supports": "Section 4: exhausted-quota rejection, optional Retry-After, and deliberately unspecified identity/counting algorithm.",
    "reviewedAt": "2026-10-07"
  },
  {
    "id": "rfc-9110-retry-after",
    "title": "RFC 9110 section 10.2.3: Retry-After",
    "organization": "IETF",
    "url": "https://www.rfc-editor.org/rfc/rfc9110.html#name-retry-after",
    "sourceType": "standard",
    "supports": "Section 10.2.3: Retry-After is an HTTP date or nonnegative integer delay in seconds, not simulator milliseconds.",
    "reviewedAt": "2026-10-07"
  },
  {
    "id": "redis-incr-rate-limiter",
    "title": "INCR: rate-limiter counter patterns",
    "organization": "Redis",
    "url": "https://redis.io/docs/latest/commands/incr/#pattern-rate-limiter",
    "sourceType": "documentation",
    "supports": "Rate-limiter patterns: time-keyed counters, attempt counting, coordinated increment/expiry and the failure gap between separate operations; implementation reference, not an emulated Redis model.",
    "reviewedAt": "2026-10-07"
  },
  {
    "id": "aws-api-gateway-throttling",
    "title": "API Gateway REST API request throttling",
    "organization": "Amazon Web Services",
    "url": "https://docs.aws.amazon.com/apigateway/latest/developerguide/api-gateway-request-throttling.html",
    "sourceType": "documentation",
    "supports": "Product-specific token-bucket rate/burst terminology and explicit best-effort target caveat; does not establish this simulator as a provider emulator.",
    "reviewedAt": "2026-10-07"
  }
]
