[
  {
    "id": "little-law",
    "title": "A Proof for the Queuing Formula: L = λW",
    "author": "John D. C. Little",
    "organization": "INFORMS",
    "url": "https://pubsonline.informs.org/doi/10.1287/opre.9.3.383",
    "sourceType": "paper",
    "relevantSections": "Public abstract: finite means and stationary-process conditions",
    "supports": "A relationship between average number in the system, arrival rate, and mean total time, under the stated theorem conditions; it does not give a worker count or burst bound.",
    "reviewedAt": "2026-10-07",
    "accessStatus": "available"
  },
  {
    "id": "google-sre-load-balancing",
    "title": "Load Balancing at the Frontend",
    "organization": "Google",
    "url": "https://sre.google/sre-book/load-balancing-frontend/",
    "sourceType": "book-chapter",
    "relevantSections": "Load balancing using DNS and at the virtual IP address",
    "supports": "Frontend routing considers traffic, datacenter capacity, and infrastructure health together; it does not derive server counts from request rates alone.",
    "reviewedAt": "2026-10-07",
    "accessStatus": "available"
  },
  {
    "id": "aws-performance-efficiency",
    "title": "PERF05-BP04 Load test your workload",
    "organization": "Amazon Web Services",
    "url": "https://docs.aws.amazon.com/wellarchitected/latest/framework/perf_process_culture_load_test.html",
    "sourceType": "documentation",
    "relevantSections": "Implementation guidance and steps",
    "supports": "Testing the entire workload under realistic conditions, with defined objectives, monitored metrics, and expected and larger loads.",
    "reviewedAt": "2026-10-07",
    "accessStatus": "available"
  },
  {
    "id": "google-sre-datacenter-load",
    "title": "Load Balancing in the Datacenter",
    "organization": "Google",
    "url": "https://sre.google/sre-book/load-balancing-datacenter/",
    "sourceType": "book-chapter",
    "relevantSections": "Least-Loaded Round Robin: limitations of active-request counts",
    "supports": "Active request counts can include time waiting on dependencies and need not be proportional to CPU capacity.",
    "reviewedAt": "2026-10-07",
    "accessStatus": "available"
  }
]
