[
  {
    "id": "rfc-9110-http-semantics",
    "title": "RFC 9110: HTTP Semantics",
    "organization": "IETF",
    "url": "https://www.rfc-editor.org/rfc/rfc9110.html",
    "sourceType": "standard",
    "relevantSections": "9.2.2 (idempotent methods), 10.2.2 (Location), 10.2.3 (Retry-After), 15.3.2 (201), 15.4.3 (302), 15.5.5 (404), 15.5.10 (409), 15.6.4 (503)",
    "supports": "HTTP method, created-resource, Location, redirect and error semantics; the caller-key replay window, product limits and uniform expiry/takedown 404 policy are chosen workshop rules.",
    "reviewedAt": "2026-10-08",
    "accessStatus": "available"
  },
  {
    "id": "rfc-3986-uri-syntax",
    "title": "RFC 3986: URI Generic Syntax",
    "organization": "IETF",
    "url": "https://www.rfc-editor.org/rfc/rfc3986.html",
    "sourceType": "standard",
    "relevantSections": "3 (syntax components), 7 (security considerations)",
    "supports": "URI scheme and authority components and security considerations; the HTTP(S)-only validation policy is an explicit workshop design choice, not a safety guarantee.",
    "reviewedAt": "2026-10-08",
    "accessStatus": "available"
  },
  {
    "id": "rfc-9111-http-caching",
    "title": "RFC 9111: HTTP Caching",
    "organization": "IETF",
    "url": "https://www.rfc-editor.org/rfc/rfc9111.html",
    "sourceType": "standard",
    "relevantSections": "5.2.2.5 (response no-store)",
    "supports": "Conforming HTTP caches must not store or reuse a response carrying no-store; this does not synchronize an application cache or guarantee privacy against hostile clients.",
    "reviewedAt": "2026-10-08",
    "accessStatus": "available"
  },
  {
    "id": "little-law",
    "title": "A Proof for the Queuing Formula: L = \u03bbW",
    "author": "John D. C. Little",
    "organization": "INFORMS",
    "url": "https://pubsonline.informs.org/doi/10.1287/opre.9.3.383",
    "sourceType": "paper",
    "relevantSections": "Public abstract: finite means and stationary-process conditions",
    "supports": "A relationship between average number in the system, arrival rate, and mean total time, under the stated theorem conditions; it does not give a worker count or burst bound.",
    "reviewedAt": "2026-10-08",
    "accessStatus": "available"
  },
  {
    "id": "aws-performance-efficiency",
    "title": "PERF05-BP04 Load test your workload",
    "organization": "Amazon Web Services",
    "url": "https://docs.aws.amazon.com/wellarchitected/latest/framework/perf_process_culture_load_test.html",
    "sourceType": "documentation",
    "relevantSections": "Implementation guidance and steps",
    "supports": "Testing the entire workload under realistic conditions, with defined objectives, monitored metrics, and expected and larger loads.",
    "reviewedAt": "2026-10-08",
    "accessStatus": "available"
  },
  {
    "id": "rfc-6585-429",
    "title": "RFC 6585: Additional HTTP Status Codes",
    "organization": "IETF",
    "url": "https://datatracker.ietf.org/doc/html/rfc6585#section-4",
    "sourceType": "standard",
    "relevantSections": "4 (429 Too Many Requests)",
    "supports": "429 denotes rate limiting and can carry Retry-After; caller identification, enforcement scope and limit values are separate design choices.",
    "reviewedAt": "2026-10-08",
    "accessStatus": "available"
  },
  {
    "id": "postgres-16-constraints",
    "title": "PostgreSQL 16: Constraints",
    "organization": "PostgreSQL Global Development Group",
    "url": "https://www.postgresql.org/docs/16/ddl-constraints.html",
    "sourceType": "documentation",
    "relevantSections": "5.4.3\u20135.4.5: unique constraints, primary keys, foreign keys",
    "supports": "Unique/compound keys, primary-key indexes and referential integrity; immutable ownership and permanent reservation retention are separate workshop rules.",
    "reviewedAt": "2026-10-09",
    "accessStatus": "available"
  },
  {
    "id": "postgres-16-insert",
    "title": "PostgreSQL 16: INSERT",
    "organization": "PostgreSQL Global Development Group",
    "url": "https://www.postgresql.org/docs/16/sql-insert.html",
    "sourceType": "documentation",
    "relevantSections": "ON CONFLICT clause and RETURNING",
    "supports": "Targeted DO NOTHING conflict handling and returned inserted rows; does not itself make the whole create/replay operation atomic.",
    "reviewedAt": "2026-10-09",
    "accessStatus": "available"
  },
  {
    "id": "postgres-16-transactions",
    "title": "PostgreSQL 16: Transactions",
    "organization": "PostgreSQL Global Development Group",
    "url": "https://www.postgresql.org/docs/16/tutorial-transactions.html",
    "sourceType": "documentation",
    "relevantSections": "3.4: transaction block, COMMIT, ROLLBACK and visibility",
    "supports": "All-or-nothing transaction boundaries; the three-record create design is an original illustrative application, not executed by this app.",
    "reviewedAt": "2026-10-09",
    "accessStatus": "available"
  },
  {
    "id": "postgres-16-isolation",
    "title": "PostgreSQL 16: Transaction Isolation",
    "organization": "PostgreSQL Global Development Group",
    "url": "https://www.postgresql.org/docs/16/transaction-iso.html",
    "sourceType": "documentation",
    "relevantSections": "13.2.1: Read Committed, concurrent conflict visibility and row locks",
    "supports": "Statement snapshots, conflicting inserts and locked-row rechecks; product retry deadlines, takedown ordering and replay retention need application design.",
    "reviewedAt": "2026-10-09",
    "accessStatus": "available"
  }
]
