[
  {
    "id": "google-sre-overload",
    "title": "Handling Overload",
    "organization": "Google SRE",
    "url": "https://sre.google/sre-book/handling-overload/",
    "sourceType": "book-chapter",
    "relevantSections": "Per-task overload protection; utilization signals; conclusions",
    "supports": "Admission and overload protection; the model uses original fixed-service numeric fixtures, not Google implementation timings.",
    "reviewedAt": "2026-10-12"
  },
  {
    "id": "aws-load-shedding",
    "title": "Using load shedding to avoid overload",
    "organization": "AWS",
    "url": "https://aws.amazon.com/builders-library/using-load-shedding-to-avoid-overload/",
    "sourceType": "engineering-article",
    "relevantSections": "Introduction; rejecting excess work to preserve useful work",
    "supports": "Overload rejection as a protection mechanism; no measured AWS capacity or reproduction of their framework is claimed.",
    "reviewedAt": "2026-10-12"
  },
  {
    "id": "java-thread-pool-executor",
    "title": "Java 17 ThreadPoolExecutor",
    "organization": "Oracle",
    "url": "https://docs.oracle.com/en/java/javase/17/docs/api/java.base/java/util/concurrent/ThreadPoolExecutor.html",
    "sourceType": "documentation",
    "relevantSections": "Core and maximum pool sizes; queuing; rejected tasks",
    "supports": "Real executor queue/worker and rejection choices for further reading; the simulator does not emulate executor growth or all policies.",
    "reviewedAt": "2026-10-12"
  }
]
